Btn/Timeout;Time's up;Время вышло
Embed/Error;Error!;Ошибка!
AlreadyUseCommand;;Вы уже используете данную команду.
DontHaveEnemies;;Кажется, в этой локации не на кого поохотиться. Попробуйте поискать врагов в другой локации.\n\nКарта мира: `/map`\nПерейти в локацию: `/travel`
DontHaveEnergy;;У вас не хватает энергии.
DontHaveShops;;Кажется, в этой локации нет магазинов. Попробуйте поискать их в другой локации.\n\nКарта мира: `/map`\nПерейти в локацию: `/travel`
TopNotLoaded;;Топ еще не загружен.
;;
